{
  "$schema": "https://json-schema.org/draft/2020-12/schema",
  "title": "Scorecard",
  "type": "object",
  "additionalProperties": false,
  "required": [
    "schema_version",
    "scorecard_id",
    "subject",
    "evaluated_at",
    "repo_commit",
    "run_tier",
    "adapter",
    "command",
    "cases",
    "metrics",
    "evidence_artifacts",
    "validation_commands",
    "verdict",
    "risks",
    "next_actions"
  ],
  "properties": {
    "schema_version": {
      "type": "string",
      "minLength": 1
    },
    "scorecard_id": {
      "type": "string",
      "minLength": 1
    },
    "subject": {
      "type": "string",
      "minLength": 1
    },
    "evaluated_at": {
      "type": "string",
      "format": "date-time",
      "pattern": "^\\d{4}-\\d{2}-\\d{2}T\\d{2}:\\d{2}:\\d{2}(?:\\.\\d+)?(?:Z|[+-]\\d{2}:\\d{2})$"
    },
    "repo_commit": {
      "type": "string",
      "pattern": "^[0-9a-fA-F]{7,40}$"
    },
    "run_tier": {
      "enum": [
        "smoke",
        "iteration",
        "release"
      ]
    },
    "adapter": {
      "type": "object",
      "additionalProperties": false,
      "required": [
        "runtime",
        "version",
        "command_mode",
        "sandbox_write_mode",
        "capability_evidence"
      ],
      "properties": {
        "runtime": {
          "type": "string",
          "minLength": 1
        },
        "version": {
          "type": "string",
          "minLength": 1
        },
        "command_mode": {
          "enum": [
            "native_commands",
            "markdown_specs",
            "mixed",
            "unknown"
          ]
        },
        "sandbox_write_mode": {
          "enum": [
            "read_only",
            "workspace_write",
            "approval_gated",
            "unrestricted",
            "unknown"
          ]
        },
        "capability_evidence": {
          "type": "array",
          "minItems": 1,
          "items": {
            "type": "string",
            "minLength": 1
          }
        }
      }
    },
    "command": {
      "type": "string",
      "minLength": 1
    },
    "cases": {
      "type": "object",
      "additionalProperties": false,
      "required": [
        "total",
        "passed",
        "failed",
        "skipped",
        "failures"
      ],
      "properties": {
        "total": {
          "type": "integer",
          "minimum": 0
        },
        "passed": {
          "type": "integer",
          "minimum": 0
        },
        "failed": {
          "type": "integer",
          "minimum": 0
        },
        "skipped": {
          "type": "integer",
          "minimum": 0
        },
        "failures": {
          "type": "array",
          "items": {
            "type": "string"
          }
        }
      }
    },
    "metrics": {
      "type": "object",
      "additionalProperties": false,
      "required": [
        "coverage",
        "confidence",
        "notes"
      ],
      "properties": {
        "coverage": {
          "type": "integer",
          "minimum": 0,
          "maximum": 100
        },
        "confidence": {
          "enum": [
            "low",
            "medium",
            "high"
          ]
        },
        "notes": {
          "type": "array",
          "items": {
            "type": "string"
          }
        }
      }
    },
    "evidence_artifacts": {
      "type": "array",
      "minItems": 1,
      "items": {
        "type": "object",
        "additionalProperties": false,
        "required": [
          "path",
          "description"
        ],
        "properties": {
          "path": {
            "type": "string",
            "minLength": 1
          },
          "description": {
            "type": "string",
            "minLength": 1
          }
        }
      }
    },
    "validation_commands": {
      "type": "array",
      "minItems": 1,
      "items": {
        "type": "object",
        "additionalProperties": false,
        "required": [
          "command",
          "result"
        ],
        "properties": {
          "command": {
            "type": "string",
            "minLength": 1
          },
          "result": {
            "type": "string",
            "minLength": 1
          }
        }
      }
    },
    "verdict": {
      "enum": [
        "pass",
        "fail",
        "blocked",
        "mixed"
      ]
    },
    "risks": {
      "type": "array",
      "items": {
        "type": "string"
      }
    },
    "next_actions": {
      "type": "array",
      "minItems": 1,
      "items": {
        "type": "string",
        "minLength": 1
      }
    }
  }
}
